<?xml version="1.0" encoding="UTF-8"?>
<laneDefinitions xmlns="http://www.matsim.org/files/dtd"
                 xmlns:xsi="http://www.w3.org/2001/XMLSchema-instance"
                 xsi:schemaLocation="http://www.matsim.org/files/dtd http://www.matsim.org/files/dtd/laneDefinitions_v2.0.xsd">
    <lanesToLinkAssignment linkIdRef="l1">
        <lane id="l1_l0">
            <leadsTo>
                <toLink refId="l2"/>
            </leadsTo>
            <capacity vehiclesPerHour="1800.0"/>
            <startsAt meterFromLinkEnd="0.0"/>
            <alignment>0</alignment>
            <attributes>
                <attribute name="osm:lane.confidence" class="java.lang.String">present</attribute>
                <attribute name="lane-kind" class="java.lang.String">bus</attribute>
            </attributes>
        </lane>
        <lane id="l1_l1">
            <leadsTo>
                <toLane refId="l2_l0"/>
            </leadsTo>
            <capacity vehiclesPerHour="1800.0"/>
            <startsAt meterFromLinkEnd="45.0"/>
            <alignment>1</alignment>
            <attributes>
                <attribute name="lane-kind" class="java.lang.String">car</attribute>
            </attributes>
        </lane>
    </lanesToLinkAssignment>
    <lanesToLinkAssignment linkIdRef="l2">
        <lane id="l2_l0">
            <leadsTo>
                <toLink refId="l3"/>
            </leadsTo>
            <capacity vehiclesPerHour="900.0"/>
            <alignment>0</alignment>
            <attributes>
                <attribute name="lane-kind" class="java.lang.String">mixed</attribute>
            </attributes>
        </lane>
    </lanesToLinkAssignment>
</laneDefinitions>
